### ISSUE TITLE
Upgrade Renci.SshNet library to correctly handle SSH banner exchange

### ISSUE THREAD

**Issue by renard** [duplicati/duplicati#4413]
- [X] I have searched open and closed issues for duplicates.

----------------------------------------

## Environment info

- **Duplicati version**: 2.0.5.1_beta_2020-01-18
- **Operating system**: MacOS 10.15.7
- **Backend**: SFTP (with SFTPgo 1.2.2 server)

## Description

The Renci.SshNet library seems to wait for the server before sending its banner. Renci.SshNet has been updated to handle this RFC4253 requirement (see: https://github.com/sshnet/SSH.NET/blob/767fafbfc1606e55ee144fa8a49167bae0f0d798/src/Renci.SshNet/Connection/ProtocolVersionExchange.cs#L38-L42).

See the tcpdump trace:

```
tcpdump: verbose output suppressed, use -v or -vv for full protocol decode
listening on any, link-type LINUX_SLL (Linux cooked), capture size 262144 bytes
21:44:15.580489  In ethertype IPv4 (0x0800), length 80: 100.127.1.18.52566 > 100.127.0.1.2222: Flags [S], seq 3016917323, win 65535, options [mss 1380,nop,wscale 6,nop,nop,TS val 1804512227 ecr 0,sackOK,eol], length 0
        0x0000:  4500 0040 0000 4000 4006 70a7 647f 0112  E..@..@.@.p.d...
        0x0010:  647f 0001 cd56 08ae b3d2 814b 0000 0000  d....V.....K....
        0x0020:  b002 ffff 4aa6 0000 0204 0564 0103 0306  ....J......d....
        0x0030:  0101 080a 6b8e abe3 0000 0000 0402 0000  ....k...........
21:44:15.580514 Out ethertype IPv4 (0x0800), length 76: 100.127.0.1.2222 > 100.127.1.18.52566: Flags [S.], seq 3971314312, ack 3016917324, win 65535, options [mss 1380,sackOK,TS val 4222245901 ecr 1804512227,nop,wscale 9], length 0
        0x0000:  4500 003c 0000 4000 4006 70ab 647f 0001  E..<..@.@.p.d...
        0x0010:  647f 0112 08ae cd56 ecb5 7288 b3d2 814c  d......V..r....L
        0x0020:  a012 ffff ca3f 0000 0204 0564 0402 080a  .....?.....d....
        0x0030:  fbaa 5c0d 6b8e abe3 0103 0309            ..\.k.......
21:44:15.646585  In ethertype IPv4 (0x0800), length 68: 100.127.1.18.52566 > 100.127.0.1.2222: Flags [.], ack 1, win 2052, options [nop,nop,TS val 1804512289 ecr 4222245901], length 0
        0x0000:  4500 0034 0000 4000 4006 70b3 647f 0112  E..4..@.@.p.d...
        0x0010:  647f 0001 cd56 08ae b3d2 814c ecb5 7289  d....V.....L..r.
        0x0020:  8010 0804 cadc 0000 0101 080a 6b8e ac21  ............k..!
        0x0030:  fbaa 5c0d                                ..\.
21:44:15.646871 Out ethertype IPv4 (0x0800), length 90: 100.127.0.1.2222 > 100.127.1.18.52566: Flags [P.], seq 1:23, ack 1, win 128, options [nop,nop,TS val 4222245967 ecr 1804512289], length 22
        0x0000:  4500 004a 2cae 4000 4006 43ef 647f 0001  E..J,.@.@.C.d...
        0x0010:  647f 0112 08ae cd56 ecb5 7289 b3d2 814c  d......V..r....L
        0x0020:  8018 0080 ca4d 0000 0101 080a fbaa 5c4f  .....M........\O
        0x0030:  6b8e ac21 5353 482d 322e 302d 5346 5450  k..!SSH-2.0-SFTP
        0x0040:  476f 5f31 2e32 2e32 0d0a                 Go_1.2.2..
21:44:15.680682  In ethertype IPv4 (0x0800), length 68: 100.127.1.18.52566 > 100.127.0.1.2222: Flags [.], ack 23, win 2141, options [nop,nop,TS val 1804512339 ecr 4222245967], length 0
        0x0000:  4500 0034 0000 4000 4006 70b3 647f 0112  E..4..@.@.p.d...
        0x0010:  647f 0001 cd56 08ae b3d2 814c ecb5 729f  d....V.....L..r.
        0x0020:  8010 085d c9f9 0000 0101 080a 6b8e ac53  ...]........k..S
        0x0030:  fbaa 5c4f                                ..\O
21:44:15.683559  In ethertype IPv4 (0x0800), length 106: 100.127.1.18.52566 > 100.127.0.1.2222: Flags [P.], seq 1:39, ack 23, win 2141, options [nop,nop,TS val 1804512341 ecr 4222245967], length 38
        0x0000:  4500 005a 0000 4000 4006 708d 647f 0112  E..Z..@.@.p.d...
        0x0010:  647f 0001 cd56 08ae b3d2 814c ecb5 729f  d....V.....L..r.
        0x0020:  8018 085d 2c23 0000 0101 080a 6b8e ac55  ...],#......k..U
        0x0030:  fbaa 5c4f 5353 482d 322e 302d 5265 6e63  ..\OSSH-2.0-Renc
        0x0040:  692e 5373 684e 6574 2e53 7368 436c 6965  i.SshNet.SshClie
        0x0050:  6e74 2e30 2e30 2e31 0d0a                 nt.0.0.1..
21:44:15.683568 Out ethertype IPv4 (0x0800), length 68: 100.127.0.1.2222 > 100.127.1.18.52566: Flags [.], ack 39, win 128, options [nop,nop,TS val 4222246004 ecr 1804512341], length 0
        0x0000:  4500 0034 2caf 4000 4006 4404 647f 0001  E..4,.@.@.D.d...
        0x0010:  647f 0112 08ae cd56 ecb5 729f b3d2 8172  d......V..r....r
        0x0020:  8010 0080 ca37 0000 0101 080a fbaa 5c74  .....7........\t
        0x0030:  6b8e ac55                                k..U
```

## Steps to reproduce

1. Setup duplicati with a sftp backend
2. Run ` tcpdump -i any -Xnnlpe port 2222`

This should be solved with a SSH.NET upgrade. It would be nice if this could be included in the next release.
See https://github.com/sshnet/SSH.NET/releases/tag/2020.0.0

**Comment by warwickmm** [comment]
See pull request #4406.
